UserName,ScreenName,Location,TweetAt,OriginalTweet,Sentiment
1256307245706432514,,,2020-05-02 01:09:23 +0530,NEW BLOG POST Our AVP is reflecting on his experience working at the Redwood Health Center amidst the COVID 19 pandemic its impact on the healthcare system and an earthquake on top of it all,Positive
1256286392080089089,,,2020-05-01 23:46:31 +0530,In What World Post COVID 19 amp examine short term threats amp scenarios that could emerge from the pandemic s fallout The impact of COVID19 is extensive on public health amp economic growth StrongerPostCOVID 2 n,Positive
1256041779343659008,,,2020-05-01 07:34:30 +0530,Mental Health and COVID 19 Research from Hong Kong post SARS shows the biggest impact on mental health could be after the pandemic is finished when we are no longer pulling together but negative social and economic effects are ongoing,Negative
1255978675000020992,,,2020-05-01 03:23:45 +0530,How do you post about COVID 19 impact on mental health When the department is a huge factor impacting the mental health of NY,Positive
1255899556694429696,,,2020-04-30 22:09:22 +0530,Shepell and access to services is so limited Telehealth is wonderful but not as effective for everyone as face to face can be Fearful of the post COVID impact on the mental health of all as we get back to normal and realize that it s not in fact normal but so different,Positive
1255888145750556674,,,2020-04-30 21:24:01 +0530,We NEWS partnered to share mental health resources to support employees amp leaders coping with the impact of COVID 19 on mental health Check our latest post on mentalhealth amp coping stregies from,Positive
1255639201128710145,,,2020-04-30 04:54:48 +0530,Giving the IMPACT of COVID 19 Government visibility We have developed this survey with to identify the impact of this pandemic on our health and medical research community Please do the survey to help develop our post COVID recovery,Positive
1255630806304927752,,,2020-04-30 04:21:27 +0530,Post 1 The impact of Covid on education systems across the global south The global Coronavirus COVID 19 outbreak impacts not only our health lives and economies but also the labour market and education sector,Neutral
1255553670801915904,,,2020-04-29 23:14:56 +0530,Glad I got to listen in on the equityinCOVID webinar to hear the very important impact of post carceral reintroduction to society on the health of those who may be decarcerated as a result of COVID,Positive
1255485305043521537,,,2020-04-29 18:43:17 +0530,The Washington Post and Yale School of Public Health form the Covid Counting Consortium 3C to understand the impact of covid 19 on the U S,Neutral
1255445762240139265,,,2020-04-29 16:06:09 +0530,So I m working on a blog post for on the impact of the Covid 19 lockdown on the mental health of ECRs and PIs Specifically the anxiety around career progression Any personal anecdotes would be most welcome scicomm,Positive
1255431141219336192,,,2020-04-29 15:08:03 +0530,Interesting article on possible post Covid 19 impact on mental health and neuro disorders When we waken from the COVID nightmare what then,Positive
1255120595655643136,,,2020-04-28 18:34:03 +0530,WaPo partners with the Yale School of Public Health to form the Covid Counting Consortium to research and report on public health data and the virus impact Washington Post,Neutral
1255119864693391367,,,2020-04-28 18:31:09 +0530,WaPo partners with the Yale School of Public Health to form the Covid Counting Consortium to research and report on public health data and the virus impact Washington Post,Neutral
1255105783500623873,,,2020-04-28 17:35:12 +0530,Today at noon EST Dr Mary Bassett director of and former health commissioner of NYC unpacks the impact of COVID 19 on health inequities Post your questions for her at and join us on Facebook Live healthequity healthdisparities,Positive
1255075910899900416,,,2020-04-28 15:36:29 +0530,In this episode we examine the impact of COVID19 on Trade in Africa dushime and discuss challenges the health crisis poses to Intra African Trade and opportunities that could arise for the continent post COVID 19,Neutral
1255016762245971968,,,2020-04-28 11:41:27 +0530,COVID19 disrupts food systems What impact will that have on children health amp development What will children be eating in a post COVID world,Neutral
1255014049265233920,,,2020-04-28 11:30:41 +0530,The Washington Post and Yale School of Public Health form the Covid Counting Consortium 3C to understand the impact of covid 19 on the U S,Neutral
1254805916068859907,,,2020-04-27 21:43:38 +0530,We are working with SCC and some inspiring people with practice knowledge and lived experience to deliver our workshops in person or virtually post Covid 19 we will all have so many more challenges to address the impact of Covid19 on our future physical and mental health,Positive
1254502436909338626,,,2020-04-27 01:37:43 +0530,Informative prog on 1 000 000 1 6 people in UK developed chronic illnesses post 2008 crisis amp impact in utero and early childhood leading to later health issues COVID economic crisis could lead to health impact on 1000s in Jersey,Positive
1254356266782208000,,,2020-04-26 15:56:53 +0530,HE have a look at short movie made in Paris about Autonomous vehicles on rails operated autonomous since 1997 If we have to change the face of transportation amp impact on citizen s health post Covid we must begin to invest in systems like this,Positive
1254199118567739392,,,2020-04-26 05:32:26 +0530,Thank you for sharing this It s so important that global our leaders hear this and the impact this is having on the mental health of our children It is critical that there is an organized mental healthcare plan in place for the post Covid world InThisTogether,Positive
1253968658050605058,,,2020-04-25 14:16:40 +0530,The current global health crisis necessitates fundamental shifts in the structure and operation of schools Check out our latest Blog post on Covid 19 s impact on educational practices,Positive
1253502480153001988,,,2020-04-24 07:24:14 +0530,BSafe BSmart Thx to all the health leaders making a difference Tune into the Town Hall moderated by The Impact of COVID 19 on Veterans with Post Traumatic Stress Join us Guy,Neutral
1253419720130232320,,,2020-04-24 01:55:23 +0530,New Health Hashtag VAcovid19 The Impact of COVID 19 on Veterans with Post Traumatic Stress,Positive
1253383534934401026,,,2020-04-23 23:31:36 +0530,What World Post COVID 19 3 Scenarios s examine short term threats amp 3 scenarios that could emerge from pandemic fallout The impact of COVID19 is extensive on public health amp economic growth StrongerPostCOVID,Positive
1253346713286381570,,,2020-04-23 21:05:17 +0530,Join the Gay Johnson McDougall Center for Global Diversity and Inclusion Zoom Webinar on COVID 19 Social Inequities Impact on Mental Health The link to register can be found in the post,Positive
1253099624207917058,,,2020-04-23 04:43:26 +0530,In the post Covid 19 era when we talk about the impact of pandemics on our monolithic economy revenue and health care and the execution of home grown buffers we will consider d beauty of NCDC DG Bespectacled nice dentition yellow pawpaw pink lips Shining Gorimapa,Positive
1253044552094699521,,,2020-04-23 01:04:36 +0530,The importance of grouping patients that are recovering from Covid 19 together post step down from ITU became evident today We need to think holistically and consider the impact decisions can have on mental health and rehab journeys CriticalCar rehabmatters,Negative
1253012793676070915,,,2020-04-22 22:58:24 +0530,Must Read New post Impact of the COVID 19 Public Health Crisis on Local American Legion Posts,Positive
1252929474825539584,,,2020-04-22 17:27:19 +0530,Post COVID19 assessment will depend on indicators used e g deaths from COVID 19 and other diseases development of mental health issues economic consequences unemployment rates timeframe considered e g short term vs long term impact 17 18,Negative
1252702567441850370,,,2020-04-22 02:25:40 +0530,COVID19 has rapidly transformed prenatal labor and delivery care This transformation places added responsibility and stress on pregnant women and their care providers What will the lasting impact be in a post COVID 19 world health healthcare mrx,Positive
1252670406823116808,,,2020-04-22 00:17:53 +0530,If like many you re concerned about the impact of COVID19 on staff s mental health register for tomorrow s Free session on Psyc wellbeing of staff during and post COVID 19 with through this link,Positive
1252186528622751745,,,2020-04-20 16:15:07 +0530,Interesting blog post by one of our students on the impact of COVID 19 on indigenous communities throughout the United States The blog highlights the tensions between public health injunctions to wash hands and plumbing poverty,Positive
1252099970297184258,,,2020-04-20 10:31:10 +0530,7 Post COVID health outcomes a descriptive study 8 Occurence of renal dysfunction in COVID19 cases at admission and impact on outcomes,Neutral
1251579009214877701,,,2020-04-19 00:01:03 +0530,woodford Essential psychological skills and knowledge is embedded in post COVID rehab for patients this is not mental health but psychological well being and will impact on community outcomes for patients,Positive
1251540943238574084,,,2020-04-18 21:29:48 +0530,An important post on the impact of COVID 19 on young people s mental health Great work by Premise team members Beatriz Miranda amp Sofia MacGregor,Positive
1251341950466224129,,,2020-04-18 08:19:04 +0530,These Texts Show The Devastating Impact Of The Coronavirus On People s MentalHealth MentalHealthMatters Huge mental health crisis coming post COVID,Negative
1250504835339862017,,,2020-04-16 00:52:40 +0530,New post CARIBBEAN HEALTH Regional leaders discuss economic impact of COVID 19 on their economies,Positive
1250435369562038274,,,2020-04-15 20:16:38 +0530,Trump is focusing on the economical impact on post covid 19 what about the countries medical and mental health A lot of people are going to need help,Positive
1250129933382365186,,,2020-04-15 00:02:57 +0530,New post Grant Opportunity Impact of COVID 19 Outbreak on Minority Health,Positive
1249608374867632128,,,2020-04-13 13:30:27 +0530,There is an article with serious credibility issues as it s Standard about post covid on ICU mental health impact so there is a hope,Negative
1249608095023550464,,,2020-04-13 13:29:21 +0530,nz The seat Police Oh you re referring to the public health officials and Council staff ensuring Covid 19 has the least impact on the population The same staff who post signs at playgrounds advising people not to use the equipment as it can lead to the spread of the virus,Negative
1249225343208128519,,,2020-04-12 12:08:25 +0530,The impact of Covid19India on Dharavi truly signifies the need for holistic slum redevelopment program integrating the health component Hope post COVID 19 the Govt will provide it fresh impetus,Positive
1248946759608532993,,,2020-04-11 17:41:26 +0530,Post Covid we have two choices A new austerity regime to pay back the cost of Covid or acceptance of a the need for higher levels of taxation and public spending The choice will determine the long term impact of Covid on both health and economy,Positive
1248541942306177027,,,2020-04-10 14:52:50 +0530,Guest post COVID 19 is having a devastating impact on physical health But once the pandemic is more controlled its impact on mental health will reveal itself,Negative
1248405361498845184,,,2020-04-10 05:50:07 +0530,I been thinking too about the impact of COVID 19 on African American populations following the pandemic Resources have been directed away from various ongoing public health issues towards the pandemic what will picking up post Corona look like for African american communities,Neutral
1248155162209812480,,,2020-04-09 13:15:54 +0530,The socio economic impact of Covid 19 as with climate change as with exposure to EDCs as with poor standard of food as with access to proper health weighs heaviest on the shoulders of the lower income across the world That is the change needed post CV,Negative
1248014887118200833,,,2020-04-09 03:58:30 +0530,Interesting article with view of behavioral health expectations post Covid 19 TMS could be a big part of treating the resultant depression Returning to resilience The impact of COVID 19 on mental health and substance use via,Positive
1247987587186335744,,,2020-04-09 02:10:01 +0530,COVID 19 is the top focus for many healthcare leaders but decisions health systems make now will have an impact the success of employed networks in the future HSG s Travis Ansel shares priorities physician leaders should focus on in our latest blog post,Positive
1247889830236704769,,,2020-04-08 19:41:34 +0530,Just seen that NHS staff will be offered mental health support for COVID 19 See paper below on post traumatic stress from SARS outbreak in 2003 there are also other reports on psychological impact of SARS to emergency staff,Negative
1247871832398667777,,,2020-04-08 18:30:03 +0530,The poorest are hit the hardest ZEF researchers say in their blog post Beyond the curfew COVID 19 s impact on Colombia How can people in countries with weak or no public health systems cope with the upcoming challenges Germany un,Negative
1247840563271020545,,,2020-04-08 16:25:48 +0530,Remember the effect of medical conditions and post covid 19 health issues All can impact on petformance,Neutral
1247831609606356998,,,2020-04-08 15:50:13 +0530,Professor of Health Policy Peter Bradshaw comments on how Yorkshire s geography could affect the impact of Covid 19 on the county in the Yorkshire Post,Neutral
1247557126836322304,,,2020-04-07 21:39:32 +0530,Professor of Health Policy Peter Bradshaw comments on how Yorkshire s geography could affect the impact of Covid 19 on the county in today s Yorkshire Post,Neutral
1247467327681105920,,,2020-04-07 15:42:42 +0530,Interesting report on Top 100 Gaining and Top 100 Declining categories during COVID 19 pandemic in US March2020 Travel amp wedding related categories dominated the top declining mental health impact Home fitness amp offices top gaining dramatic work amp life shift post crisis,Positive
1247412888224047105,,,2020-04-07 12:06:23 +0530,2 a Extent of US labor market weakness post COVID b Uncertain health of the US consumer i e credit card debt auto loans student loans savings rate c Long term impact of COVID shutdown on SMEs d Debt quantum underwritten by shadow banks consumer FinCos,Negative
1247333287825158144,,,2020-04-07 06:50:04 +0530,That being said I think the post COVID impact on mental health will then accelerate the demand and mainstream acceptance,Negative
1247126214902456320,,,2020-04-06 17:07:14 +0530,In a way I fear the economical impact of COVID 19 on Nigeria in the near future more than the public health aspect Less than 2 weeks of lockdown and people are already suffering and begging more than ever I don t even want to think of the impending recession post Corona,Positive
1246852872467140609,,,2020-04-05 23:01:04 +0530,Yes But maybe not right now first transit agencies figure out study impact of post covid on transit traffic focus hard on disadvantaged populations reliant on transit and may fear health taking again position agency to re focus on mobility,Negative
1246699360278269952,,,2020-04-05 12:51:04 +0530,New post US modelling study estimates impact of school closures for COVID 19 on US health care workforce and associated mortality,Positive
1246659338933948416,,,2020-04-05 10:12:02 +0530,This post will focus on the well established methods that health economists have devised to answer question around COVID 19 impact COVID2019 COVID19Pandemic economiccrisis,Neutral
1246507607331942401,,,2020-04-05 00:09:07 +0530,The Dorcas Wangira story on COVID 19 side effect on Mental health is spot on Post COVID 19 the economy may be second to mental health in terms of impact COVID19Kenya,Negative
1246086812252037123,,,2020-04-03 20:17:01 +0530,New Post On My Blog As We Reel At The Debilitating Socio Economic Impact Of Covid 19 Let Us Not Ignore Its Effect On Mental Health,Positive
1246061602484387840,,,2020-04-03 18:36:51 +0530,CIC Spot on CIC have recognised for years the mental health impact on older people of social isolation Our phones not stopped ringing with people anxious amp worried re prolonged isolation We re recording all contacts to help inform the mh responses needed post covid,Negative
1245988368191651840,,,2020-04-03 13:45:50 +0530,We want to support efforts aimed at recovering from the crisis and are seeking start ups focused on the following Mitigation medical equipment remote health and digital tools We evaluate the ability to mitigate the impact of Covid 19 and viability post Covid 19 4 10,Negative
1245825547613032448,,,2020-04-03 02:58:51 +0530,Well crafted post congrats to the authors This is a very informative analysis of the impact of COVID 19 and plausible policy responses to safeguard public health while ensuring food security is finalizing a similar article focussing on Zambia,Positive
1245487664528347144,,,2020-04-02 04:36:13 +0530,Starts at 8pm Virtual Town Hall on the impact of Covid 19 on mental health seniors and persons with disabilities Submit your questions as comments on this post,Negative
1245437383782404097,,,2020-04-02 01:16:26 +0530,FWIW we can and should do entire additional threads on the impact on the actual healthcare and treatment system voting rights mental health the prison system education the post COVID economic hell for people of color etc This thread is focused on the testing issue,Positive
1245191370249252864,,,2020-04-01 08:58:51 +0530,On 3 25 published COVID 19 insights detailing potential economic recovery trajectories amp the impact of various public health measures A few findings I want to mention here looking specifically at China US relations which could radically change post COVID 1 5,Neutral
1245190268401287168,,,2020-04-01 08:54:29 +0530,Post Intensive Care Syndrome encompasses survivor impairments in cognition mental health and physical function Dr E Wesley Ely others discuss impact of COVID 19 Still to learn what is the impact on family members restricted from seeing their critically ill loved ones,Positive
1244711834118246400,,,2020-03-31 01:13:21 +0530,Minimizing the Risks of PTSD from the COVID 19 Pandemic In this time of uncertainty it is important to recognize the impact on mental health including the potential for developing Post Traumatic Stress Disorder PTSD,Positive
1244667466594172936,,,2020-03-30 22:17:03 +0530,Interesting Research at re impact of COVID 19 on mental health for the general population Read here Thanks for the UniWellbeing course mention for SK post secondary students stress anxiety depression go to,Positive
1244666327891152907,,,2020-03-30 22:12:32 +0530,What s the psychological impact of Quarantine on mental health In a new Elf blog post amp discuss a recent rapid review in light of the Covid 19 outbreak uk,Positive
1244561271971864578,,,2020-03-30 15:15:04 +0530,Take a look at our blog post regarding the impact of the coronavirus on health surveillance hse health surveillance COVID 19 coronavirus occupationalhealth,Neutral
1244532190916104192,,,2020-03-30 13:19:31 +0530,RT UAE Forsan DXBMediaOffice in coordination with Dubai s HealthcareCity is hosting a session on our official social media accounts to answer your questions about the novel coronavirus Covid 19 and its impact on mental health Please post your ques,Negative
1244525029473148928,,,2020-03-30 12:51:03 +0530,GOI s National Lockdown seems to be slowing the pace of Covid19 nevertheless it s too early to conclude amp understand the impact of this policy intervention both on health emergency amp on economy COVID 19 cases in the first week post Lockdown Data INDIA,Positive
1244522572135510016,,,2020-03-30 12:41:17 +0530,DXBMediaOffice in coordination with Dubai s HealthcareCity is hosting a session on our official social media accounts to answer your questions about the novel coronavirus Covid 19 and its impact on mental health Please post your questions using th,Negative
1244313909655490561,,,2020-03-29 22:52:08 +0530,in coordination with Dubai s is hosting a session on our official social media accounts to answer your questions about the novel coronavirus Covid 19 and its impact on mental health Please post your questions using the hashtag AskDXBdoctor,Negative
1244313569073795077,,,2020-03-29 22:50:47 +0530,in coordination with Dubai s is hosting a session on our official social media accounts to answer your questions about the novel coronavirus Covid 19 and its impact on mental health Please post your questions using the hashtag AskDXBdoctor,Negative
1244273717104070658,,,2020-03-29 20:12:26 +0530,Important to stay abreast of COVID 19 developments including the impact on government finances and its ability to support households and businesses during and post the health crisis,Positive
1243256092265713664,,,2020-03-27 00:48:45 +0530,Are you worried about losing your health insurance or are currently uninsured due to the impact of covid 19 Our recent FB post provides insight on eligibility requirements for health coverage via MNsure StayHome,Negative
1243221695059632129,,,2020-03-26 22:32:04 +0530,New post from COVID 19 and the technological impact for UK health and social care has been published on,Positive
1243221687707013125,,,2020-03-26 22:32:02 +0530,New post from COVID 19 and the technological impact for UK health and social care has been published on,Positive
1243091170550374400,,,2020-03-26 13:53:25 +0530,Definitely As a health care professional it is hard and often devastating to make a decision to not treat a patient like what is happening in Italy What will the impact be post COVID 19 on health professionals mental health,Negative
1242784228682526721,,,2020-03-25 17:33:44 +0530,New post JAMAICA HEALTH Jamaica acknowledges COVID 19 has had tremendous impact on the island,Positive
1242723137629945856,,,2020-03-25 13:30:59 +0530,Proof of Life 25 03 2020 Entering Day 3 of Self Isolation This post is to remind myself that as of this morning I am still alive I don t have Covid 19 but the overall impact on my mental health has been horrendous SelfIsolation MentalHealth CoronavirusLockdownUK,Neutral
1242442613036183552,,,2020-03-24 18:56:17 +0530,hanke I thought Covid 19 is having only impact on health I was wrong I had not idea it can effect one s mental condition as well Looking at your post I am confirm I pray to God that you get well soon hanke,Negative
1242108603085082626,,,2020-03-23 20:49:02 +0530,New blog post FAQ impact on economy and economic policy response to COVID 19 1st stop the virus amp do all public health needed Then why we need fiscal policy response why use safety net why help states why help firms directly,Positive
1241815471583870976,,,2020-03-23 01:24:14 +0530,New My latest post looks at Covid 19 and the impact on Mental Health and Wellbeing Would welcome suggestions and additional links or resources Please feel free to share mentalhealth covid19 wellbeing selfisolation workingfromhome ELT Online,Positive
1241398158799843329,,,2020-03-21 21:45:59 +0530,Can t wait to see whether there will be a post mortem conversation about lack of funding for public health care facilities and the impact of that on the lack of preparedness for Covid 19 We seriously expect doctors and nurses to risk their lives in the absence of sufficient,Negative
1241129068562653186,,,2020-03-21 03:56:43 +0530,In our latest blog post Patrick Trippel President amp CEO provides an update regarding COVID 19 and the actions taken to maintain the safety and well being of our Inventus Power employees as well as mitigate impact on our overall business health,Positive
1240243513662603265,,,2020-03-18 17:17:50 +0530,New post CARIBBEAN HEALTH FAO warns of the impact of COVID 19 on school feeding programmes,Positive
1239649115421761536,,,2020-03-17 01:55:55 +0530,Dear please post your report from the Italian hospitals so we can share it with with those who are in denial or not understanding the impact of Covid 19 on the health system This report was powerful and hard hitting A dead body being wheeled out from treatment,Negative
1239381571347582979,,,2020-03-16 08:12:47 +0530,1 On Wednesday the World Health Organization officially declared coronavirus COVID 19 a pandemic and heightened the concerns of our team our clients and their event guests about the impact it could have on upcoming events The attached post is the result of our DJ team,Neutral
1239274845747261444,,,2020-03-16 01:08:42 +0530,New post 141 ICU Coronavirus worldwide impact health emergency covid 19 who china iran italy india has been published on ApzWeb,Positive
1239227752747851776,,,2020-03-15 22:01:34 +0530,We ve been closely monitoring Covid 19 and are doing our part to protect our staff and customers while also reducing the impact on our precious frontline health care workers We will post any updates on our social media as decisions are made,Positive
1238630475087962112,,,2020-03-14 06:28:12 +0530,With all these cancellations and the rippling impact it s having on everyone the greater problem caused by COVID 19 may not be health related but rather economic devastation Patriot Post,Positive
1238546158009663494,,,2020-03-14 00:53:09 +0530,New post TRINIDAD HEALTH Government announces closure of schools initiates study on economic impact of COVID 19,Positive
1395773316309438464,,,2021-05-21 21:37:45 +0530,Friday Lecture Series Episode 2 Stock market reactions to Covid In this week s episode Professor Ian Tonks discusses the impact of Covid 19 on the stock market Listen to full audio,Positive
