UserName,ScreenName,Location,TweetAt,OriginalTweet,Sentiment
1257663061483274241,,,2020-05-05 18:56:54 +0530,Lightshed Partners analyst Richard Greenfield on Tuesday downgraded Disney s stock as he argued there s too little future earnings visibility to measure the COVID 19 impact on the studio s theme parks theatrical releases and other out of home businesses,Negative
1257660120668012546,,,2020-05-05 18:45:13 +0530,Can shipping demand be used to predict the stock markets How is China recovering from COVID 19 Find out in our latest blog post where we look at the impact of COVID 19 on the shipping industry vv vesselsvalue vesseldemand coronavirus shipping,Positive
1257629248787034117,,,2020-05-05 16:42:33 +0530,Today Your Money talks about the impact that the COVID 19 pandemic has on our stock market and provides you with a trader s tip I know the markets are tumbling into double digit losses but I must remind you that you really haven,Positive
1257629157854494724,,,2020-05-05 16:42:11 +0530,Today Your Money talks about the impact that the COVID 19 pandemic has on our stock market and provides you with a trader s tip I know the markets are tumbling into double digit losses but I must remind you that you really haven,Positive
1257414472328773634,,,2020-05-05 02:29:06 +0530,Today Your Money talks about the impact that the COVID 19 pandemic has on our stock market and provides you with a trader s tip I know the markets are tumbling into double digit losses but I must remind you that you really haven,Positive
1257385683133612038,,,2020-05-05 00:34:42 +0530,internal detractors of him within Congress But plz keep continue doing this The more you people try to show him as laughing stock the less is d work for BJP amp its supporters All the best Next schedule one w Greg Chappel to discuss on Indian cricket impact due to COVID,Positive
1257361533656608768,,,2020-05-04 22:58:44 +0530,Wow where d she get the money Oh wait that s right stock trades using insider information from her closed door senate briefing sessions where she learned all about covid and it s impact on the US then made profitable stock moves amp told America covid was NBD InsiderTraitor,Positive
1257173673607344129,,,2020-05-04 10:32:15 +0530,Impact of Corona Virus on the Stock Market The economic impact of Covid 19 Novel Corona virus to the world will be bigger than the consequence of SARS in 2003 Check out Who are Negatively and Positively impacted from the same Read,Positive
1257169081129676800,,,2020-05-04 10:14:00 +0530,Do you remember being read a story at bedtime There is lots of debate on the positive vs negative impact of COVID 19 but one thing is for sure It has made us take stock on so many levels personally in business and our future A story of it s own,Positive
1257154085666652160,,,2020-05-04 09:14:25 +0530,Due to the impact of Covid 19 Zealous Swimwear will be closing All current orders will be completed and dispatched accordingly while discontinued stock will remain on the website until June 30th READ FULL POST,Positive
1257140538790248450,,,2020-05-04 08:20:35 +0530,RT AshVerma111 StocksInNews POWER STOCKS PM Modi held a detailed meeting on the Power Sector amp took stock of the impact of COVID 2019 Discussed long term reforms for enhancing sustainability resilience and efficiency Keep Cos Like KalpataruPower On Radar CNBC Awaa,Positive
1257133487007469569,,,2020-05-04 07:52:34 +0530,StocksInNews POWER STOCKS PM Modi held a detailed meeting on the Power Sector amp took stock of the impact of COVID 2019 Discussed long term reforms for enhancing sustainability resilience and efficiency Keep Cos Like KalpataruPower On Radar Awaaz AwaazMarkets,Positive
1257099019907665920,,,2020-05-04 05:35:36 +0530,PM Modi held a detailed meeting on the Power Sector and took stock of the impact of COVID 19 He also discussed various long term reforms for enhancing sustainability resilience and efficiency of the sector,Positive
1257027121697841152,,,2020-05-04 00:49:54 +0530,Buffett rubbishes these numbers Claims doesn t had much time impact on balance sheets as the YoY yield for the past quarter has grown despite COVID 19 More noise as always Keeps the stock bulls at bay nothing more,Positive
1257004581923500033,,,2020-05-03 23:20:21 +0530,nigeria sdgs Nigeria A6 There is the need for stock taking to determine the impact of the COVID 19 on the SDGs at country level to inform policies to mitigate its impacts and chart new path towards recovering JCIAUKickoutCovid19,Positive
1256945526999670784,,,2020-05-03 19:25:41 +0530,PrimeMinister of India NarendraModi held a detailed meeting on the PowerSector amp took stock of the impact of COVID 19 He also discussed various long term reforms for enhancing sustainability resilience and,Positive
1256865457769975809,,,2020-05-03 14:07:31 +0530,Could now be a good time to settle As companies and individuals involved in litigation take stock of their priorities our article looks at the impact of COVID 19 on ongoing cases,Positive
1256854762085105664,,,2020-05-03 13:25:01 +0530,A Wall Street analyst just put a rare sell recommendation on Amazon s stock due to concerns about COVID 19 s economic impact via,Positive
1256593625485586433,,,2020-05-02 20:07:21 +0530,Microsoft Says Covid 19 Had Minimal Impact On Revenue In Its Latest Quarter Its Stock Is Rising via,Positive
1256262147048267777,,,2020-05-01 22:10:10 +0530,SBMH Mauritius stock price recovery in April of 8 to 4 collapse failed to trigger upside break of revised focus 3 5 and pinched new low at 3 60 b4 end April close 3 75 from steady decline in profitability from peak 2017 It s yet cover Covid 19 impact on economic activities,Positive
1256243306834669569,,,2020-05-01 20:55:18 +0530,STOCK MARKET AND COVID 19 David Anderson with Moneywise Wealth Management joined 17 News at Sunrise to discuss the relationship between the stock market and the economy along with the impact COVID 19 has had on the economy,Neutral
1256228864029863939,,,2020-05-01 19:57:55 +0530,PM today held a detailed meeting on the Power Sector amp took stock of the impact of COVID 19 He also discussed various long term reforms for enhancing sustainability resilience and efficiency of the sector,Positive
1256206795237994497,,,2020-05-01 18:30:13 +0530,PM NarendraModi today held a detailed meeting on the Power Sector amp took stock of the impact of COVID 19 He also discussed various long term reforms for enhancing sustainability resilience and efficiency of the sector PMO PMModi Coronavirus Lockdown3,Positive
1256204957977579522,,,2020-05-01 18:22:55 +0530,PM Narendra Modi today held a detailed meeting on the Power Sector amp took stock of the impact of COVID 19 He also discussed various long term reforms for enhancing sustainability resilience and efficiency of the sector PMO,Positive
1256204604376743936,,,2020-05-01 18:21:31 +0530,PM today held a detailed meeting on the Power Sector amp took stock of the impact of COVID 19 He also discussed various long term reforms for enhancing sustainability resilience and efficiency of the sector PMO,Positive
1256204595144962053,,,2020-05-01 18:21:29 +0530,PM Narendra Modi today held a detailed meeting on the Power Sector amp took stock of the impact of COVID 19 He also discussed various long term reforms for enhancing sustainability resilience and efficiency of the sector PMO TV9News,Positive
1256203788676820997,,,2020-05-01 18:18:17 +0530,PM held a detailed meeting on the Power Sector amp took stock of the impact of COVID 19 He also discussed various long term reforms for enhancing sustainability resilience and efficiency of the sector ANI For more updates,Positive
1256203401563721729,,,2020-05-01 18:16:44 +0530,IndiaFightsCorona PM held a meeting on the Power Sector amp took stock of the impact of COVID 19 India India,Neutral
1256202081758658560,,,2020-05-01 18:11:30 +0530,PM today held a detailed meeting on the Power Sector amp took stock of the impact of COVID 19 He also discussed various long term reforms for enhancing sustainability resilience and efficiency of the sector PMO ANI Live Updates,Positive
1256201966255878145,,,2020-05-01 18:11:02 +0530,PM NarendraModi today held a detailed meeting on the Power Sector amp took stock of the impact of COVID 19 He also discussed various long term reforms for enhancing sustainability resilience and efficiency of the sector PMO,Positive
1256201446099320832,,,2020-05-01 18:08:58 +0530,PM today held a detailed meeting on the Power Sector amp took stock of the impact of COVID 19 He also discussed various long term reforms for enhancing sustainability resilience and efficiency of the sector,Positive
1256201031081320448,,,2020-05-01 18:07:19 +0530,PM Narendra Modi today held a detailed meeting on the Power Sector amp took stock of the impact of COVID 19 CoronavirusPandemic coronavirus COVID19 lockdown IndianEconomy,Positive
1256200920523837441,,,2020-05-01 18:06:53 +0530,PM Narendra Modi today held a detailed meeting on the Power Sector amp took stock of the impact of COVID 19 He also discussed various long term reforms for enhancing sustainability resilience and efficiency of the sector PMO,Positive
1256200622509940738,,,2020-05-01 18:05:42 +0530,Breaking PM today held a detailed meeting on the power sector amp took stock of the impact of COVID 19 He also discussed various long term reforms for enhancing sustainability resilience and efficiency of the sector Details by TIMES NOW s Megha Prasad,Positive
1256131708203737091,,,2020-05-01 13:31:51 +0530,New Taking Stock Podcast Declan Ryan co founder of Ryanair on impact of Covid 19 on Aviation Alan Ahearne Inst on the US Economy on Brazil amp Bolsonaro Listen now wherever you get your Podcasts amp,Positive
1255978484108791810,,,2020-05-01 03:23:00 +0530,UPDATE Stock markets plunged after economic growth data confirmed fears of COVID 19 s bruising impact on the world economy,Positive
1255969789668974592,,,2020-05-01 02:48:27 +0530,Amazon shareholders may want to take a seat Bezos Impact of coronavirus on stock market Plan your wealth and health Bezos amazon USequities sp500 COVID earningsseason coronavirus techtitans apple neverlankanalysis SmallBusinesses,Neutral
1255967374337101825,,,2020-05-01 02:38:51 +0530,In 2019 AAPL experienced a big reset higher in valuation The stock has retained basically all of that increase in PE despite Covid 19 and its adverse impact on consumer appetites for a 1200 iPhone I say replacement cycle grows elongated I remain large short,Positive
1255965997166743554,,,2020-05-01 02:33:23 +0530,Comcast Warns Covid19 To Have Adverse Impact On Near Nasdaq As a result the company expect the impacts of COVID 19 to increase in The following table summarizes whether the Stock meets each of this strategy s tests Company Descrip,Positive
1255954097527828480,,,2020-05-01 01:46:06 +0530,BREAKING Amazon Q1 profit drops 29 despite revenue surge Amazon stock fell after hours after the company reported its Q1 earnings revealing the Covid 19 pandemic s impact on the business that has been a rare bright spot on the stock market,Positive
1255952575305834496,,,2020-05-01 01:40:03 +0530,AMAZON EARNINGS Amazon stock fell after hours after the company reported its Q1 earnings revealing the Covid 19 pandemic s impact on the business that has been a rare bright spot on the stock market,Positive
1255950523578138624,,,2020-05-01 01:31:53 +0530,During the month of April many Yale SOM finance faculty have been sought out to comment on the impact of Covid 19 on the economy the past amp future of the stock market unemployment rates housing killer acquisitions stimulus payments amp more SOMfinfac,Positive
1255895075097153536,,,2020-04-30 21:51:33 +0530,Bill Ackman the Pershing Square hedge fund manager set up a 27 Million hedge in February speculating a stock market carnage resulting from an adverse impact of the Covid 19 health crisis He cashed out on March 23 and earned a windfall profit of 2 6 Billion,Neutral
1255872614398115843,,,2020-04-30 20:22:18 +0530,Corona Virus has affected different sectors of markets differently To find out the impact of COVID 19 on various sectors of stock markets amp economy check out this video corona virus economy lockdown,Neutral
1255857289447211008,,,2020-04-30 19:21:25 +0530,MolsonCoors earnings today showing impact of on premise sales loss despite uptick in my least favorite term of Covid pantry loading Sales for April are down 14 overall Stock down over 10 at start of trading today,Negative
1255851405170147330,,,2020-04-30 18:58:02 +0530,I cannot think of a non tech household name with a semi functional business and a consistent global presence that performs so poorly on the stock market And while COVID has had its impact troubles seem to have started from long before,Negative
1255829483334119428,,,2020-04-30 17:30:55 +0530,Join our CEO at the ROCKITVilnius online panel discussion on the impact of coronavirus on global stock markets I May 6th I 4 pm EEST evarvest stockmarket stockmarketvolatility event LT covid,Neutral
1255822633087746051,,,2020-04-30 17:03:42 +0530,Hi we ve been working on this exciting project since December The funding comes from the Libraries Engagement project and does not have an impact on money spent on library stock The public engagement part of this pilot project has been delayed due to the Covid 19 outbreak,Positive
1255820627774185472,,,2020-04-30 16:55:44 +0530,HE Helal Al Marri Director General of Dubai Tourism As we take stock of the economic impact caused by COVID 19 on all sectors of which tourism was one of the most impacted we see our recovery coming across 3,Positive
1255818480626077696,,,2020-04-30 16:47:12 +0530,Coronavirus COVID 19 Impact on GCC Telecoms Coronavirus Impact on Global Stock Markets Coronavirus Impact on GCC Stock Markets Coronavirus Impact on GCC Sectors GCC Economic Stimulus GCC Telecom Sector,Positive
1255714729382699009,,,2020-04-30 09:54:56 +0530,Microsoft Says Covid 19 Had Minimal Impact On Revenue In Its Latest Quarter Its Stock Is Rising,Positive
1255711260160724993,,,2020-04-30 09:41:09 +0530,Microsoft Says Covid 19 Had Minimal Impact On Revenue In Its Latest Quarter Its Stock Is Rising Transformation digital via,Positive
1255629056797741062,,,2020-04-30 04:14:30 +0530,Microsoft Says Covid 19 Had Minimal Impact On Revenue In Its Latest Quarter Its Stock Is Rising Transformation digital via,Positive
1255626192889225218,,,2020-04-30 04:03:07 +0530,Microsoft Says Covid 19 Had Minimal Impact On Revenue In Its Latest Quarter Its Stock Is Rising Barron s,Positive
1255619928843059203,,,2020-04-30 03:38:13 +0530,Microsoft Says Covid 19 Had Minimal Impact On Revenue In Its Latest Quarter Its Stock Is Rising via,Positive
1255618223141089281,,,2020-04-30 03:31:27 +0530,And many of them remained bears 20 lower I don t have a view on if it will go that low again however I do know there was some outstanding value in a few stock that will have no negative impact from COVID 19,Positive
1255617131070345217,,,2020-04-30 03:27:06 +0530,u3000 Microsoft Says Covid 19 Had Minimal Impact On Revenue In Its Latest Quarter Its Stock Is Rising,Positive
1255614650135216132,,,2020-04-30 03:17:15 +0530,Microsoft Says Covid 19 Had Minimal Impact On Revenue In Its Latest Quarter Its Stock Is Rising Barron s,Positive
1255606630210768896,,,2020-04-30 02:45:23 +0530,Microsoft Says Covid 19 Had Minimal Impact On Revenue In Its Latest Quarter Its Stock Is Rising Transformation digital via,Positive
1255601370117353472,,,2020-04-30 02:24:29 +0530,Big Tech thus far holding up remarkably well Google Facebook say ad prices are strengthening after a steep drop in March Microsoft says covid 19 has had minimal impact on revenue Microsoft stock within 5 of its all time high,Positive
1255600626639278082,,,2020-04-30 02:21:31 +0530,Microsoft Overall the company s revenue increased 15 to 35B during Q3 of 2020 Operating income jumped to 13B up 25 Driven by its commercial cloud business COVID 19 had minimal net impact Stock trading up 4 after hours I ll likely report on its conference call,Negative
1255578332281921536,,,2020-04-30 00:52:56 +0530,Yeah I was wondering if maybe his crazy tweets last night had anything to do with the impact on today s earnings report Maybe negatively affected more than everyone anticipates No clue Don t really care I still own the stock If Covid creates a big dip backin up my truck,Positive
1255555252511801344,,,2020-04-29 23:21:13 +0530,The negative impact of the Covid 19 pandemic on the economy cannot be ignored we saw the stock markets crash worldwide and even crude oil fell below 1,Negative
1255524581739200514,,,2020-04-29 21:19:21 +0530,Impact of coronavirus on stock market Plan your wealth and health StockMarket JSE ZSE COVID19 COVID coronavirus business economy economicactivity SmallBusiness entrepreneurship HealthcareHeroes riskmanagement,Neutral
1255472698714738693,,,2020-04-29 17:53:11 +0530,Could now be a good time to settle As companies and individuals involved in litigation take stock of their priorities our article looks at the impact of COVID 19 on ongoing cases,Positive
1255214196318441472,,,2020-04-29 00:45:59 +0530,We re partnering with Network for their COVID 19 Update on Friday May 1 at 1 pm This webinar will help employees gain insight into the stock market volatility and understand how the CARES Act may impact their retirement plan Register Here,Neutral
1255213277036056577,,,2020-04-29 00:42:20 +0530,Facebook FB stock could jump after Wednesday s earnings report despite the impact of COVID 19 on the company s advertising model Rakamoto NYSC TuesdayThoughts Blockchain Crypto Bitcoin Digital Money Coins Dollar Banks,Neutral
1255124352619524098,,,2020-04-28 18:48:59 +0530,Checkout what is the Impact of Covid 19 on the Stock Market,Neutral
1255036925892689921,,,2020-04-28 13:01:35 +0530,IndusInd reported significant fall in loan growth rise in bad loans amp provisioning Yet the stock has rallied 9 today Why Read analysis on Q4 results and how Covid led disruptions can impact the business,Negative
1254943752474378242,,,2020-04-28 06:51:20 +0530,Charted The Impact of COVID 19 on the World s Major Stock Indexes via net covid19 DataViz HowMuchDataViz Stocks Index Trading,Positive
1254896671139467265,,,2020-04-28 03:44:15 +0530,AMC Theatres stock price is down 74 from June 1st while Netflix s stock price is up 27 In this VOTD looks at the economic impact of Coronavirus COVID 19 on various industries Check it out,Positive
1254890301023551493,,,2020-04-28 03:18:57 +0530,A Wall Street analyst just put a rare sell recommendation on Amazon s stock due to concerns about COVID 19 s economic impact AMZN doc2cloud,Positive
1254862971898978305,,,2020-04-28 01:30:21 +0530,Music Cities Together and a variety of local music industry focused organizations have come together to take stock and gather data involving the impact of COVID 19 on our local music community with the COVID 19 Austin Music Impact Survey,Neutral
1254860391508619264,,,2020-04-28 01:20:06 +0530,A Wall Street analyst just put a rare sell recommendation on Amazon s stock due to concerns about COVID 19 s economic impact AMZN,Positive
1254844154926051331,,,2020-04-28 00:15:35 +0530,A Wall Street analyst just put a rare sell recommendation on Amazon s stock due to concerns about COVID 19 s economic impact AMZN,Positive
1254844153579466758,,,2020-04-28 00:15:34 +0530,A Wall Street analyst just put a rare sell recommendation on Amazon s stock due to concerns about COVID 19 s economic impact AMZN news greatbusiness,Positive
1254842997109403651,,,2020-04-28 00:10:59 +0530,A Wall Street analyst just put a rare sell recommendation on Amazon s stock due to concerns about COVID 19 s economic impact,Positive
1254835074547286019,,,2020-04-27 23:39:30 +0530,From an ESG standpoint has received consistently negative scores on sentiment related to social impact and the COVID 19 pandemic data underpinning some interesting stock analysis from ti gt,Positive
1254764250112933890,,,2020-04-27 18:58:04 +0530,COVID 19 s impact on the supermarket supply chain goes far beyond the stock of food itself,Positive
1254738887769030656,,,2020-04-27 17:17:17 +0530,latest Rimmer hospital amp community offices are full to the ceiling with unsold easter stock of junk while we get daily emerging data about the disproportionate impact of covid on pre existing conditions u200d We can t change our genes during the pandemic we can choose to feed our staff better,Positive
1254729500107198466,,,2020-04-27 16:39:59 +0530,The Taking Stock Podcast tooze on the Full Impact of the Covid 19 Global Shock amp Future Recovery on Donald Trump Deutsche Bank amp the Last Financial Crash Listen now wherever you get your Podcasts or,Positive
1254661537802878976,,,2020-04-27 12:09:55 +0530,After a successful Season 1 we re back with Season 2 of The Salary Stories where we discuss the COVID 19 Impact on salaries employee benefits stock options and share the best practices from across the globe on tackling the pandemic Stay tuned for more information Aon,Positive
1254617578627928064,,,2020-04-27 09:15:15 +0530,After Macquarie report Stock Up 5 nifty Stock Macquarie On Mindtree Maintain U P TP Cut To Rs 670 From Rs 734 Q4 Weaker Than Expectations Despite No Impact Of COVID On Rev High Exposure To Travel amp Hospitality Will Hurt Significantly In H1FY21 Lower FY21 22 EPS Est By 9 22,Positive
1254569679999373312,,,2020-04-27 06:04:55 +0530,The impact of COVID 19 on the UK markets is an example of systematic risk that impacted the entirety of the stock market and so could not be diversified away Despite the whole market impact many of locked down businesses will see prices drop for their goods or services,Positive
1254466296420368385,,,2020-04-26 23:14:06 +0530,Time to stock up on red color cartridges for the printer Any chance that the initial COVID funding can be repurposed to address revenue shortfalls This will lessen impact in the near term but spending levels will have to be adjusted going forward,Positive
1254343084202250240,,,2020-04-26 15:04:30 +0530,JOIN US for a FREE Brainstorming Session on 28th April 2020 How to Encounter The Impact of COVID 19 on Warehousing and Stock Management in Africa Date 28th April 2020 11 00 AM 12 00 PM EAT GMT 3 Registration Link,Positive
1253860368301977600,,,2020-04-25 07:06:22 +0530,the entirety of covid s impact on my tiny amount of stock it was totally worth all those human lives,Positive
1253754968474914818,,,2020-04-25 00:07:32 +0530,Serie A Femminile and the Coronavirus Crisis What Will Happen To The League Alamy Stock Photo The first in a series of pieces that will examine the impact of the ongoing COVID 19 crisis on the league and how it will affect the players The ongoing,Positive
1253732950258135042,,,2020-04-24 22:40:03 +0530,Delighted I am hosting this Webinar next Thursday 5pm speaker Max Lewis u2066 u2069 u2066 u2069 for a longer term view of how the future may look RSVP via link Impact of COVID 19 on Financial Remedies on Divorce OGR Stock Denton,Positive
1253730671916388353,,,2020-04-24 22:31:00 +0530,The Wilstein Team is OpenForBusiness Watch this month s webinar to hear Ron talk about how the COVID 19 situation is impacting Park City Real Estate along with information on the impact of low interest rates and the stock market crash BuyParkCity,Positive
1253655543337627650,,,2020-04-24 17:32:27 +0530,New Taking Stock Podcast tooze on the Full Impact of the Covid 19 Global Shock amp Future Recovery on Donald Trump Deutsche Bank amp the Last Financial Crash Listen now wherever you get your Podcasts or,Positive
1253628546473476096,,,2020-04-24 15:45:11 +0530,Charted The Impact of COVID 19 on the World s Major Stock Indexes via net covid19 economy businesses investment Stocks Trading,Positive
1253591529526001664,,,2020-04-24 13:18:05 +0530,New Taking Stock Podcast tooze on the Full Impact of the Covid 19 Global Shock amp Future Recovery on Donald Trump Deutsche Bank amp the Last Financial Crash Listen now or wherever you get your Podcasts,Positive
1253564328281686018,,,2020-04-24 11:30:00 +0530,Stock markets tanked as investors struggled to understand the impact of Covid 19 on listed companies globally AB looks at how management teams can help,Neutral
1253540895133241347,,,2020-04-24 09:56:53 +0530,FREE Brainstorming Session How to Encounter The Impact of COVID 19 on Warehousing and Stock Management in Africa Date 28th April 2020 11 00 AM 12 00 PM EAT GMT 3 Registration Link,Positive
1253398933407137798,,,2020-04-24 00:32:47 +0530,This is no accident It was intentional to have negative impact on Gilead and potentially bring the stock down Gilead was able to create vaccine for Ebola then they can create vaccine for Covid 19 We have to rely on companies like Gilead for creating cure for diseases,Positive
1253394341235589120,,,2020-04-24 00:14:32 +0530,Tech Stock News CounterPath NASDAQ CPAH TSX PATH TO Provides Update on Impact of COVID 19,Neutral
1253393081967144960,,,2020-04-24 00:09:32 +0530,Tech Stock News CounterPath NASDAQ CPAH TSX PATH TO Provides Update on Impact of COVID 19 Technology,Neutral
1253389812553244673,,,2020-04-23 23:56:32 +0530,Learn more about the impact of COVID 19 on stock prices using APIs and Postman Visualizer Fifth time on Twitch D,Positive
1253368035898847232,,,2020-04-23 22:30:00 +0530,Euromonitor International s research analysts and analytics teams are monitoring the impact of COVID 19 to better assess the short and long term effects on economic scenarios product categories pricing stock availability and consumer behaviour,Positive
