UserName,ScreenName,Location,TweetAt,OriginalTweet,Sentiment
1313883933537337345,,,2020-10-07 22:18:35 +0530,Did you know there s a senator named Richard Burr who did a bunch of insider stock trading after a closed door session about COVID 19 s impact on the economy Why is Richard Burr getting a massive free pass,Positive
1313832612679618565,,,2020-10-07 18:54:39 +0530,NOW ServiceNow Unveils The Work Survey A Comprehensive Global View of COVID 19 s Impact on Work and the O From our Stock News Alerts App,Neutral
1313760274608947200,,,2020-10-07 14:07:12 +0530,The guy you retweeted was commenting specifically about the stock market And he was specifically referencing the mid day impact of the president s sudden decision to suspend all negotiations on a COVID relief bill until after the election The stock market responded poorly,Negative
1313711169002237953,,,2020-10-07 10:52:04 +0530,Sat waiting for the Trump reversal on COVID 19 support It will happen once he sees the devastating impact on the stock market Another waste of space decision from a waste of space president Time to resign fail,Negative
1313665488443133953,,,2020-10-07 07:50:33 +0530,Someone must have cut through the medication overdose to talk some sense into your head You succeeded in crashing the stock market that you love so much You really need to hand over the presidency to someone who is capable COVID is having quite an impact on you,Positive
1313413576963420161,,,2020-10-06 15:09:33 +0530,Impact of COVID19 on Indian Stock Markets economy covid business finance money coronavirus economics india stockmarket news investing politics indianeconomy investment economia stocks lockdown entrepreneur education bitcoin pandemic trading motivation,Neutral
1313300834000797696,,,2020-10-06 07:41:33 +0530,Quantifying the impact of COVID 19 on the US stock market An analysis from multi source information arXiv 2008 10885v3 UPDATED quant finance,Neutral
1313254501025869824,,,2020-10-06 04:37:26 +0530,Just as this article links a protracted delayed vaccine deployment and stock for some Big Pharma including Abbott Laboratories soaring the scale of the COVID 19 pandemic in the United States has an impact on the market for tests amp treatments 7,Neutral
1313216577718935552,,,2020-10-06 02:06:45 +0530,Funny that no one has commented that Trump before going to the hospital asked about the impact him having Covid has had on the economy No damn impact because the stock market is not the economy It isn t like the economy turns up or down in days or weeks let alone hours,Positive
1313212194436325378,,,2020-10-06 01:49:20 +0530,PBF is a very attractive stock for long term investors right now Although on March 30 2020 PBF Energy announced that it has suspended its quarterly dividend of 0 30 per share on its Class A common stock as part of its strategic plan to respond to the impact of the COVID 19,Positive
1313086362007015426,,,2020-10-05 17:29:19 +0530,Markets are unfazed by Trump s coronavirus uncertainty Stocks rallied overnight in Asia and U S stock futures are poised to open higher as markets have shown little impact from news that President Trump was diagnosed with COVID 19 on Friday The state,Positive
1313046797481390081,,,2020-10-05 14:52:06 +0530,The president Trump health condition rumours facts amp speculations will have a direct impact on the financial markets volatility trump financial markets stock usd dollar currencies metals oil Covid 19 health volatility adfc rumours facts speculation,Positive
1313024356956602369,,,2020-10-05 13:22:56 +0530,Impact on Cinemas is understated but improving COVID Tech rapid testing and prevention like hospital air purifiers will have these back in action sooner than expected as fear abates The key stock watch may be those tech companies,Neutral
1312536206761029632,,,2020-10-04 05:03:12 +0530,New Op ed in The Hill What impact will Trump s COVID illness have on stock markets Much more volatility from political amp economic uncertainty created by his medical condition,Positive
1312485676663799810,,,2020-10-04 01:42:24 +0530,I predict on Monday the stock market won t react well to this weekend s news and as a result some republicans who haven t felt enough of a COVID economic impact yet might be affected but they ll still vote party line,Positive
1312447340075126784,,,2020-10-03 23:10:04 +0530,COVID 19 Impact on Gold Bullion Market Size Share Segmentation and Top Key Players Analysis 2020 Mitsubishi Materials Argor Heraeus Valcambi Suisse Stock Market Funda bullionnews news investment,Positive
1312395310325477378,,,2020-10-03 19:43:19 +0530,Given Trump s positive Covid test there is no doubt that we will see marked stock market volatility in the short term Watch Ramin s latest video where he shares his thoughts on the potential long term impact,Positive
1312236737134026753,,,2020-10-03 09:13:12 +0530,Entire chain of succession contract COVID Azerbaijan Armenia at war India China at war Israel Iran at war Terrorist attack against US interests Stock Market Crash Aliens land on Earth Huge solar flare Meteor impact Take your pick,Positive
1312189971801882625,,,2020-10-03 06:07:23 +0530,New article Will President Trump s COVID 19 diagnosis impact stock market Expert says no has been published on Fintech Zoom Fintech Blockchain Crypto Cryptocurrency ICO,Positive
1312120594180132864,,,2020-10-03 01:31:42 +0530,Trump Covid Political Impact Thread 4 20 And Trump held Super Spreader events regularly against local government regulations on health amp safety Trump is a mass murderer He even PROFITS from the suffering by pushing Hydroxychloroquine he owns stock in company that makes it,Positive
1312089334548324359,,,2020-10-02 23:27:29 +0530,His 1 2 3 concerns are the short term growth of the stock market Anything he is forced to do because it is part of the responsibly of the President that doesn t have a direct impact on the stock market is a bore to him His reaction to COVID is always first,Positive
1312068814037635072,,,2020-10-02 22:05:56 +0530,The whole stock market is selling off cause Trump got COVID like damn imagine being the person who has that kinda impact on the world,Positive
1312052671218581505,,,2020-10-02 21:01:48 +0530,Trump the first lady and other officials have tested positive for COVID 19 Pence has tested negative HofstraExperts can discuss the potential impact on the Trump administration amp the 2020 race as well as the stock market dip in the wake of this news,Positive
1312044634990956546,,,2020-10-02 20:29:52 +0530,this is super rich because Loeffler profited off of the pandemic by selling tons of stock after a Senate briefing on the potential impact of COVID 19 all while doing nothing to actually like stop the virus,Positive
1312031531343523841,,,2020-10-02 19:37:48 +0530,Hey remember when covid news first started the rounds and the stock market still trudged onwards and upwards and people myself included were skeptical about the impact on the markets it would have,Negative
1312026209421844480,,,2020-10-02 19:16:39 +0530,It is interesting how just the news about Trump s confirmed case of COVID has such a great impact on the stock market,Positive
1312013639084175360,,,2020-10-02 18:26:42 +0530,Earlier the stock markets would have no impact on crypto markets It was reverse quite often Not anymore Even trump getting covid makes market go red I see this as sign of crypto coming of age,Neutral
1312012483616534529,,,2020-10-02 18:22:06 +0530,Monitor your stocks The President s COVID 19 diagnosis could have a enormous impact on the stock market today StockMarket,Neutral
1312004011994820609,,,2020-10-02 17:48:26 +0530,Color me petty but I m really digging that coverage this morning really focused on the impact of his positive COVID test on the stock market And that the impact on the market wasn t that bad so far,Positive
1311941167135809536,,,2020-10-02 13:38:43 +0530,Trump might not have an impact on everyone s life But it does have an impact on stock market bhide taarakmehta jethalal nifty dowjones indianstockmarket usmarket trump covid nse bse memes marketmemes,Neutral
1311906800351023105,,,2020-10-02 11:22:09 +0530,A couple of side effects to the COVID 19 news to watch for tomorrow The stock market is likely to be down a brutal amount And I wonder if this news will have an impact on the still struggling stimulus bill,Negative
1311877732620402688,,,2020-10-02 09:26:39 +0530,US President Trump says he amp the First Lady will quarantine after aide Hope Hicks tested positive for COVID 19 Bloomberg No much impact on US stock futures for now as both S amp P 500 and Nasdaq 100 futures are slightly down by around 0 2 since today s early Asian session,Positive
1311877702085795841,,,2020-10-02 09:26:32 +0530,US President Trump says he amp the First Lady will quarantine after aide Hope Hicks tested positive for COVID 19 Bloomberg No much impact on US stock futures for now as both S amp P 500 and Nasdaq 100 futures are slightly down by around 0 2 since today s early Asian session,Positive
1311692563464835074,,,2020-10-01 21:10:51 +0530,Interesting on both points When you have the Federal Reserve blowing up the bubble with all assets including equities leading to record highs in the stock market despite limited GDP growth taking out Covid impact I do think you have to tax capital gains higher,Positive
1311498451197341698,,,2020-10-01 08:19:31 +0530,Loeffler and her husband who is the head of the New York Stock Exchange made millions selling off stocks after she sat in on closed door briefings about the potential impact of COVID 19 right before the market tanked,Positive
1311498406964101125,,,2020-10-01 08:19:21 +0530,Loeffler and her husband who is the head of the New York Stock Exchange made millions selling off stocks after she sat in on closed door briefings about the potential impact of COVID 19 right before the market tanked,Positive
1311498352555634689,,,2020-10-01 08:19:08 +0530,Loeffler and her husband who is the head of the New York Stock Exchange made millions selling off stocks after she sat in on closed door briefings about the potential impact of COVID 19 right before the market tanked,Positive
1311498278496874497,,,2020-10-01 08:18:50 +0530,Loeffler and her husband who is the head of the New York Stock Exchange made millions selling off stocks after she sat in on closed door briefings about the potential impact of COVID 19 right before the market tanked,Positive
1311413776017551360,,,2020-10-01 02:43:03 +0530,Important analysis in piece Covid impact on working people people of color is devastating Trump sacrificed lives for stock market So has every Republican VoteThemOut,Negative
1311404207405174784,,,2020-10-01 02:05:02 +0530,I think we are all wondering what impact the Second Wave of COVID 19 will have on the economy and stock markets Jeffrey Kleintop SVP Chief Global Investment Strategist Charles Schwab amp Company shares some thoughts investments covid19,Neutral
1311316523060015105,,,2020-09-30 20:16:36 +0530,While the cruise industry and markets waiting on No Sail decision My commentary COVID 19 severely impacts the Blue Economy and impact on state shows this is more than a stock story via,Positive
1311251540506681345,,,2020-09-30 15:58:23 +0530,All the four mega crises have happened during republican presidencies Only the 4th one during Trump s tenure covid has not had a lasting impact on the stock market,Neutral
1311157616605712387,,,2020-09-30 09:45:10 +0530,True but I think that point that you missed was that Trump is only interested in the stock market while the real economy that impacts those on the streets is the small businesses that are failing and therefore we are losing because of the impact of COVID 19,Positive
1310759961283104768,,,2020-09-29 07:25:02 +0530,Stock Photography Market 2020 COVID 19 After Impact Analysis on Leading Vendors Thinkstock Adobe Stock iStock Stocksy United Photos of India Imagedb Getty Images Dreamstime Smugmug Veer Shutterstock Zenfolio 123RF Pixabay Pixpa The,Neutral
1310724804442501121,,,2020-09-29 05:05:20 +0530,As the COVID 19 pandemic unleashes its devastating impact on the nation s economy now is the time to take stock of your current financial situation amp establish healthy habits Here s help 30Seconds covid19 coronavirus money,Negative
1310694532024094720,,,2020-09-29 03:05:02 +0530,The COVID 19 pandemic has made a big impact on our economy this year however the stock market reached new highs in September How can that be Learn our investment team s take in our latest blog post FNBOInsights Investing,Positive
1310596012151648258,,,2020-09-28 20:33:33 +0530,sentiment on company not stock company is best in history For consumers in the US Amzn isn t just a good choice like in years before it s more The Rescuer Of Holiday Season in Covid 2020 Image and impact never been that high retail never been that profitable amazon,Positive
1310474367609044992,,,2020-09-28 12:30:11 +0530,s CLUED IN take stock of lessons learned during the first 6 months of the Covid 19 pandemic and its impact on inclusive business companies Check it out here,Positive
1310297261046366211,,,2020-09-28 00:46:25 +0530,just looked at your website and every electric trolley is out of stock obviously the COVID pandemic has had an impact on this I am looking to upgrade my trolley in a few weeks what are my chances of getting a new motocaddy one,Negative
1309893331858501632,,,2020-09-26 22:01:21 +0530,I have to choose just 3 McConnel amp Graham are 1 amp 2 I have no fondness for Collins but Senator betrayed everyone in the U S when she chose to make millions in stock trades immediately after a confidential Senate briefing on the catastrophic impact of COVID 19,Neutral
1309549076707454981,,,2020-09-25 23:13:24 +0530,OPTI Looks like reducing cholesterol may impact on Covid 19 I ll need to stock up on my It looks like reducing blood cholesterol reduces the ability of the virus to enter the cell and hence offers some protection,Positive
1309498893126770689,,,2020-09-25 19:54:00 +0530,Jessie Actually Covid did have an impact on private and company pensions because of the stock market falling due to the pandemic So you are wrong,Negative
1309488545933991936,,,2020-09-25 19:12:53 +0530,fdn We are still reeling from the impact of COVID 19 in general We are still taking stock and documenting I am sure the data on unsafe abortions in correlation to the rise in teenage pregnancies will confound us,Positive
1308859970813931524,,,2020-09-24 01:35:09 +0530,Discover the impact of the COVID 19 pandemic on the aftermarket including a new miles driven index from Arity auto care industry stock performance recent quarter sales growth and more,Positive
1308829785859198976,,,2020-09-23 23:35:12 +0530,Discover the impact of the COVID 19 pandemic on the aftermarket including a new miles driven index from Arity auto care industry stock performance recent quarter sales growth and more,Positive
1308804806589452289,,,2020-09-23 21:55:56 +0530,The latest episode of DamiensMidweekMarkets is out now Markets plan for a COVID second wave This week I talk about the possibility of a second COVID wave and the potential impact it could have on stock markets Watch the show here,Positive
1308768265829842945,,,2020-09-23 19:30:44 +0530,Read our blog on the impact of Covid 19 on the global stock markets stockmarket fintech stocks,Neutral
1308507609775902726,,,2020-09-23 02:14:59 +0530,LULU LULU Form 8K On September 22 2020 we determined to restart our previously authorized stock repurchase program which had been temporarily paused in connection with other measures related to the impact of COVID 19,Negative
1308501114250289161,,,2020-09-23 01:49:11 +0530,LULU Form 8K On September 22 2020 we determined to restart our previously authorized stock repurchase program which had been temporarily paused in connection with other measures related to the impact of COVID 19,Negative
1308500389977878537,,,2020-09-23 01:46:18 +0530,ibrahim Tottenham Barnes Carlin1 harrison tabois dacosta Hare ross UK The 21st Sept 2020 Haringey Adults amp Health scrutiny panel has a lot of important reading on Learning Disability amp Autism services a stock take on the Council s adult services and the impact of Covid on care homes Watch it via xa0,Positive
1308492241556647948,,,2020-09-23 01:13:55 +0530,Educating English Learners during the COVID 19 Pandemic Policy Ideas for States and School Districts from this policy brief takes stock of the impact schools response to the pandemic is having on ELs and immigrant background students,Neutral
1308418906198102022,,,2020-09-22 20:22:31 +0530,DSS Dots get connected and likely not today but this is a 20 stock Easily could become next biggest and most demand Covid name on the street with Impact Biomedical,Positive
1308378384842608647,,,2020-09-22 17:41:30 +0530,Another GameStop preorder stock Xbox Series X 8 Xbox Series S 2 COVID definitely having an impact on in person orders due to crowd limits,Negative
1308045448301522944,,,2020-09-21 19:38:31 +0530,To understand the impact of COVID 19 on Global Rolling Stock Market Request a free sample at mobilityforesights covid corona COVID19 railroad trains train rail railway railways railfan trainspotting railfans rails locomotive trainspotter,Positive
1307969470560759808,,,2020-09-21 14:36:37 +0530,To understand the impact of COVID 19 on Rolling Stock Market in North America Request a free sample at mobilityforesights covid corona COVID19 northamerica railroad trains train rail railway railways trainspotting railfans rails locomotive,Positive
1307757393187610625,,,2020-09-21 00:33:54 +0530,April 3 Dallas Fed joins EPA Green Power Partnership April 27 Minneapolis Fed partners with Data Foundation on Covid impact survey June 15 Fed begins rationing coins June 25 Fed places restrictions on banks freezing stock buybacks and limiting payouts,Negative
1307698511933177856,,,2020-09-20 20:39:55 +0530,He is 1 an idiot who 2 thought he could manipulate COVID s impact on the stock market and 3 therefore not endanger his re election prospects by 4 convincing us to shrug and look away Did I mention he s an idiot TrumpLiedPeopleDied,Negative
1307404808983400454,,,2020-09-20 01:12:51 +0530,In order to appreciate the impact has had on s stock price you have to look at similar casino stocks and how they ve performed since Covid MGM back to 68 of pre Covid highs RRR back to 65 of pre Covid highs BYD back to 79 of pre Covid highs,Neutral
1307345954371039232,,,2020-09-19 21:18:59 +0530,wolves1 Nobody has responded to this Covid has caused an financial impact across the world countries have lost workers jobs We have printed money to pay for it We are on a verge of financial drama Stock market have predicted this so not a good gauge,Negative
1307268893602390016,,,2020-09-19 16:12:46 +0530,Those fence sitters are the important ones Brexit isn t fully done yet and covid is still here The future is yet to be made Impact will take at least 2 years And the election is a way off This is simply taking stock on Johnson s failings and Starmer s start as labour leader,Positive
1307258603393421312,,,2020-09-19 15:31:53 +0530,Almost every Question in Parliament on COVID 19 impact on life livelihoods and businesses gets a stock answer from this SHAMELESS MODI government NO DATA,Neutral
1307236512761655296,,,2020-09-19 14:04:06 +0530,Almost every Question in Parliament on COVID 19 impact on life livelihoods and businesses gets a stock answer from this shameless government NO DATA This a complete mockery of Parliament and an insult to the people of India,Positive
1306847148370259978,,,2020-09-18 12:16:54 +0530,V interested in HillRom Holdings HRC I thought high demand in hospital beds due to Covid 19 would be driving their stock this year Has Covid had a negative impact instead Is there an effect on their long term business plans or is the market reacting to short term results,Negative
1306622757812211716,,,2020-09-17 21:25:15 +0530,Obvious Trump panic claim means if people know the truth about COVID precautions will be taken less activity and impact on stock market Not rocket Science Deciding my fate with credible information is my constitutional right don t live in Russia already have a Dad,Positive
1306614060822257666,,,2020-09-17 20:50:42 +0530,Buffet Trump re elected Bet requires Trump in ofc 8 31 2021 Redfield masks reduce COVID risk in vulnerable 65 will get vax but negatively impact 99 9865 of USA population Great bet Bad science Never risk on Resistance losers No thanks I ll put 250 stock 3x 8 31 2021,Negative
1306559814970019841,,,2020-09-17 17:15:09 +0530,Volunteer to help the Buxton shop get back on its feet after the devastating financial impact of Covid 19 They need help on the sales floor stock room and in the book department Get involved today,Negative
1306545211967930368,,,2020-09-17 16:17:07 +0530,RENT Comscore Uncovers the Impact of COVID 19 on Small Business Credit Card Applications From our Stock News Alerts App,Negative
1306545204435054592,,,2020-09-17 16:17:05 +0530,SCOR Comscore Uncovers the Impact of COVID 19 on Small Business Credit Card Applications From our Stock News Alerts App,Negative
1306357209044062209,,,2020-09-17 03:50:04 +0530,InteriorDesigner explains Wayfair s explosive 10X stock growth and the impact of COVID 19 on retail to The PropTechVC here,Neutral
1306247733615919105,,,2020-09-16 20:35:03 +0530,Taking Stock of Where We Are A Look at the Impact of COVID 19 on Grocery Shopper Habits via ORG GroceryShopping HealthyEating KitchenTips,Neutral
1306216859335680001,,,2020-09-16 18:32:22 +0530,The impact of Covid 19 on the economy is expected to adversely affect revenue generation Given the current and projected expenditure demands it is estimated that the Kenyan debt stock could reach Sh9 2 trillion in FY 2022 23 said the National Treasury SokoNews,Negative
1306103333912850432,,,2020-09-16 11:01:15 +0530,Charted The Impact of COVID 19 on the World s Major Stock Indexes,Positive
1305990486310752257,,,2020-09-16 03:32:50 +0530,Eagon Limited stock usually I missed out on Volo s and Xanithars which I m annoyed about but not usually this bad Seems the distributor didn t get enough stock from Wizards Maybe Covid impact not sure Or may just not be released at the same time as the regular cover,Negative
1305938898154127361,,,2020-09-16 00:07:51 +0530,PanIIT USA had a successful virtual conference with Bloomberg News guest Vinay Nair amp Bombay Stock Exchange MD Ashish Chauhan with Devin Banerjee of LinkedIn as Moderator discussing the impact of COVID 19 on FINTECH what is the new Norm,Positive
1305936793120976896,,,2020-09-15 23:59:29 +0530,PanIIT USA with WHEELS had a successful virtual conference with Bloomberg News guest Vinay Nair and Bombay Stock Exchange MD Ashish Chauhan with Devin Banerjee of LinkedIn as Moderator discussing the impact of COVID 19 on FINTECH what is the new Norm,Positive
1305918789502943233,,,2020-09-15 22:47:56 +0530,Chinese e commerce rose to prominence during the SARS outbreak in 2002 03 Unlike SARS outbreak the Covid pandemic is going to have a negative impact on the e commerce industry in India Long delivery timelines out of stock of fast moving SKUs Increased prices may deter 1 n,Positive
1305904966230593536,,,2020-09-15 21:53:01 +0530,Forthcoming Coronavirus Impact on Stock Prices and Growth Expectations by Niels J Gormsen and Ralph S J Koijen both COVID,Neutral
1305866625506250752,,,2020-09-15 19:20:40 +0530,The impact of COVID 19 on stock market performance is leading many retirees and those close to retirement to question their investment strategy Link s workplace savings plans vehicles take the worry out of retirement investing for your employees,Positive
1305540582094274561,,,2020-09-14 21:45:05 +0530,Oxford Analytica graphic analysis takes stock of the global impact of Covid 19 on GDP and trade,Neutral
1305517479288922113,,,2020-09-14 20:13:17 +0530,It s the COVID pandemic all over again Trucks are not delivering to grocery stores due to firea Customers are seeking out of stock items on amp more How will this impact restaurants on amp diners,Positive
1305326961548357633,,,2020-09-14 07:36:14 +0530,Thank you for taking the dive into teaching One thing about COVID I hope parents realize what teachers do and appreciate the HUGEEEE impact teachers have on their child s life Stock up on the clearance deals for this year and next,Neutral
1305252459850485767,,,2020-09-14 02:40:11 +0530,schult I didn t know or believe he would literally sacrifice human lives in order to win an election or mitigate the impact on the stock market of COVID 19 I always believed in checks and balances in government Not anymore,Positive
1304782532672536576,,,2020-09-12 19:32:52 +0530,Jordan This shows your apparent lack of regard for human life especially those who must work and the impact COVID 19 has had on families of the 190K dead or dealing with complications from the virus It s only the stock market with Trump What s your excuse,Negative
1304619973860569089,,,2020-09-12 08:46:55 +0530,He is talking about COVID a type of infectious disease and it s impact on public health as part of normal life both are exact his expertise areas He doesn t t offered advice opinion beyond these You are the one ask him about stock You shall ask trump he is your guy,Positive
1304125565453119488,,,2020-09-11 00:02:18 +0530,Trump didn t give a crap about whether or not YOU would feel fearful over the truth about COVID Trump knows his words impact the stock market His reelection depends on the market amp he didn t want to upset the Dow TrumpLiedPeopleDied TrumpKnew trumpvirus ResignNowTrump,Negative
1304042449145389057,,,2020-09-10 18:32:02 +0530,RRD RRD RRD Study Shows the Impact of COVID 19 on Marketer Perceptions of Artificial Intelligence Machine From our Stock News Alerts App,Negative
