UserName,ScreenName,Location,TweetAt,OriginalTweet,Sentiment
1395824074350333954,,,2021-05-22 00:59:27 +0530,LongCovid Levelling up Without adequate fair share funding to Northwest NHS systems to meet the disproportionately higher post COVID burden many areas in the NW region will experience a double whammy health amp economy impact on recovery,Positive
1395400703263141889,,,2021-05-20 20:57:07 +0530,It s good that has been consistently tracking patients post COVID health Good job We need to understand the impact of COVID treatments on their health As Mumbai was hit by the 2nd wave first its learnings will help all other states to avoid our errors 15 n,Positive
1395318385794293763,,,2021-05-20 15:30:01 +0530,COVID 19 s impact on mental health has added urgency to the need for evidence based transdisciplinary patient centered medical care Helen Lavretsky MD who spoke at GW s 2019 Sung Symposium has set up one of the few post COVID care clinic for long haulers via,Negative
1395142171477512194,,,2021-05-20 03:49:48 +0530,Report cites COVID s impact on PNG health Post Courier,Neutral
1394510562848088064,,,2021-05-18 10:00:01 +0530,Did you see Mental health impact on at risk high level athletes during COVID 19 lockdown A pre during and post lockdown longitudinal cohort study of adjustment disorder This piece was featured in an story,Positive
1394365547425398785,,,2021-05-18 00:23:47 +0530,New post Bionics And Smart Prosthesis MARKET IS TRENDING REPORT WITH COVID 19 IMPACT ANALYSIS TOP COMPANIES LIKE Bioparx Health Technology HDT Global KSU has been published on FUNDSWIFT,Positive
1394311262314459139,,,2021-05-17 20:48:04 +0530,Now that almost half of US has been vaccinated for COVID19 what patient driven topics projects should we look at next Suggestions ex Caregivers mental health post covid ex Effects of LongCOVID ex Impact on disproportionately affected populations healthequity,Negative
1394185920174231552,,,2021-05-17 12:30:00 +0530,Obesity is a key influence on Covid outcomes and post pandemic population health But stigma against those who are above a healthy weight has devastating impact Watch discusses how to talk about weight without invoking stigma ASOconference2021,Negative
1393994123779133446,,,2021-05-16 23:47:52 +0530,2 Our Post Pandemic Fight Climate Change I am fearful of experiencing the possible consequences of catching the COVID 19 virus But I am equally fearful of the impact of climate change will have on our planet health and society,Negative
1393978292202582020,,,2021-05-16 22:44:58 +0530,People who got covid may end up with post covid health issues which may last a life time It also had an indirect impact because of loss of job and loss of lives on many to summarise we may never be able to calculate the havoc done by it in our lifetime,Positive
1393159164386447364,,,2021-05-14 16:30:03 +0530,EuropeanMentalHealthWeek Just 30 minutes to go until our next event Join us and at 12 30 on our Instagram Hear from 2 Post Grad students who will discuss their experience of mental health and the impact of COVID 19,Negative
1392894707290841088,,,2021-05-13 22:59:11 +0530,Covid 19 s impact on women has been significant So what can we do to ensure our cardiac health post pandemic In the video Dr Ragupathi shares with us the main thing she s encouraging her patients to do Check it out CardiacPartners ThisIsWhatWeLiveFor WomensHealthWeek,Positive
1392795287207489537,,,2021-05-13 16:24:08 +0530,NEW BLOG POST Meet Lorena amp Danny f They re producing animated short Demi s Panic a response to the impact of the Covid pandemic on mental health Brilliantly teamed w amp,Positive
1392612548730507264,,,2021-05-13 04:17:59 +0530,NEW COVIDGovernance post This article highlights EGAPer and co author s recent paper in that looks at the public health impact of sharing information on the racial disparities in COVID 19 related deaths,Positive
1391838724980310016,,,2021-05-11 01:03:05 +0530,Fighting Stigma Focus on Children s Long term Post COVID Health as New RCPCH Presidency Starts Addressing the annual symposium of the British Paediatric Surveillance Unit BPSU he emphasised the damaging impact of COVID 19 on children xa0,Positive
1391159144585961473,,,2021-05-09 04:02:41 +0530,No one is holistically interested on the impact of young and sudden onset menopause in post breastcancer women It s just as massive a problem on their mental as it is their physical health Covid made their lives worse too,Negative
1391052799279083525,,,2021-05-08 21:00:06 +0530,COVID 19 is spreading rapidly in Michigan As case numbers rise vaccinations are critical to saving lives and find a post pandemic normal Experts from ACCESS and Detroit Medical Center discussed the impact COVID 19 has on our health,Positive
1390951940607987713,,,2021-05-08 14:19:19 +0530,New post Healthy young adults who had COVID 19 may have long term impact on blood vessels and heart health has been published on The Relationship Tips,Positive
1389876444357087235,,,2021-05-05 15:05:41 +0530,Join us on Friday where we will be joined by our expert panel and s Ro to reflect on the impact of COVID 19 on the NHS and look ahead to a post pandemic health service RSVP at mhp events com,Neutral
1389696508497252352,,,2021-05-05 03:10:41 +0530,vivek Spot on actual impact on economy and luxury consumption sectors will be seen now With so many covid cost of post covid healthcare savings for health insurance will make few sectors take backseat Only must consumption will grow Long winters ahead,Positive
1389584471402373121,,,2021-05-04 19:45:29 +0530,Today s Linked In post references a NY Times article on the impact of COVID on people s mental health It focuses on COVID creating a feeling of languishing RM and IA using legacy methods may also be afflicted,Negative
1389424610936979456,,,2021-05-04 09:10:16 +0530,provides education on Asian American mental heath and racism during and post COVID 19 See how discrimination historic oppression and perspective impact the Asian American community 410ASpr21,Negative
1388648275742380034,,,2021-05-02 05:45:23 +0530,The comments on this thread are Concerning long term health outcomes for individuals post covid Impact on MH and health services could be huge,Positive
1388452281461379073,,,2021-05-01 16:46:34 +0530,Methinks we have been left to our own design and machinations thrown under the bus The administration does not seem to have a coherent plan on how to handle Covid the disease and Post Covid social health or economic impact WE MUST STRICKLY FOLLOW KAGWES HEALTH COMMERCIAL,Positive
1388097402997936131,,,2021-04-30 17:16:25 +0530,Yes Remember my tweet last week about psychological abberations post covid We are getting to see them right now Journalists are worried about impact of reporting covid deaths on their mental health This is a new world strange and absurd signs are here,Negative
1388092255173554180,,,2021-04-30 16:55:57 +0530,Experts look at the lasting impact of the pandemic on public health Many of us didn t get enough physical activity and need to get in shape u200d u200d u200d As well many patients continue to suffer from lingering symptoms post Covid 19,Positive
1387729460535889924,,,2021-04-29 16:54:20 +0530,EVENT Join us next Friday where we will be joined by a stellar panel Ro to reflect on the impact of COVID 19 on the NHS and look ahead to a post pandemic health service RSVP mhp events com,Positive
1387716057431908356,,,2021-04-29 16:01:05 +0530,A groundbreaking study into the psychological impact of COVID 19 pandemic on NHS workers finds that PPE shortages were associated with severe mental health symptoms Sian Norris reports The post PTSD In NHS Workers Coronavirus Health,Negative
1387689093904093187,,,2021-04-29 14:13:56 +0530,Thanks for such an interesting gddf2021 and the chance to take part Kns and Phyllis talk Building inclusive impact first solutions for digital health Reflecting on a pre and post COVID 19 world is still available to watch go to,Positive
1387628291981516800,,,2021-04-29 10:12:20 +0530,I agree those community programs and school impact crime Likely the rise was a combo of school community programs covid police standing down Post covid will prove impact of each The health of our cities depend on low crime suburbanization is a disaster,Negative
1387419323925471232,,,2021-04-28 20:21:58 +0530,In a post COVID world maintaining good health will depend heavily on preventive health habits So where can you begin Read our recent blog to learn the 10 small healthy changes that will have a big impact on your health and well being,Positive
1387416709825454083,,,2021-04-28 20:11:35 +0530,An important study from highlighting the impact of the pandemic on vulnerable children s mentalhealth Wolfson Centre s Prof outlines the urgent need to provide support amp focus on children s longer term mental health outcomes post COVID 19,Negative
1387406034562605057,,,2021-04-28 19:29:10 +0530,EVENT Join us next Friday where I will be joined by a stellar panel to reflect on the impact of COVID 19 on the NHS and look ahead to a post pandemic health service RSVP mhp events com,Positive
1386691353548005378,,,2021-04-26 20:09:16 +0530,Dear Ram anna In the midst of so many things Pls post something about your health progress as on today I m sure covid had not much impact on a brave year person like you We wish and pray for ur quick recovery and back in action,Positive
1386263290750308356,,,2021-04-25 15:48:18 +0530,48 hours post covid vaccine and back on it with It still amazes me sometimes that people you ve never met can have such a positive impact on your life both emotionally and physically Thank you and all the team fitness workout sundayvibes Health,Positive
1385976204956741634,,,2021-04-24 20:47:32 +0530,COVID Natural Remedies BANNED as DOJ and FTC Seek to Silence Doctors Promoting Vitamin D C Zinc etc The above is an article on the Health Impact News site which twitter won t allow me to post Fine is 10k for promoting the above supplements,Positive
1385975936424759299,,,2021-04-24 20:46:28 +0530,COVID Natural Remedies BANNED as DOJ and FTC Seek to Silence Doctors Promoting Vitamin D C Zinc etc The above is an article on the Health Impact News site which twitter won t allow me to post Fine is 10k for promoting the above,Positive
1385726812974510080,,,2021-04-24 04:16:32 +0530,Impact on health of COVID survivors post recovery Interesting insight,Positive
1385355700461842434,,,2021-04-23 03:41:52 +0530,We cannot under estimate the impact of this pandemic on health care workers Burned out by covid doctors are considering quitting medicine The Washington Post,Neutral
1385230777688932354,,,2021-04-22 19:25:28 +0530,One Vision is presenting a free live webinar exploring post COVID 19 syndrome on 26 April at 7pm Panellists including Jim McManus Director of Public Health will discuss the impact of LongCovid research and treatments Watch live at,Positive
1385169628461154305,,,2021-04-22 15:22:29 +0530,Looking forward to my keynote today RebootingIreland summit on our tech fuelled obsession with speed amp acceleration and the dark side impact on health amp well being First up Luke O Neill and CEOs on the future of work post Covid Full agenda,Positive
1384944029863981056,,,2021-04-22 00:26:02 +0530,1 Covid 19 impact on mental health 2 Role of healthcare leaders 3 What can be done next Read the full post xa0 ThatMedicNetwork xa0 TMN xa0 medtwitter xa0 healthcare,Positive
1384915355429130240,,,2021-04-21 22:32:05 +0530,Comments by Brian Shilhavy Editor Health Impact News Severe cramping heavy bleeding for days on end post menopausal women all of a sudden menstruating again irregular periods and more are all being reported by women after being injected with a COVID experimental shot But,Positive
1384846140349288450,,,2021-04-21 17:57:03 +0530,Let s all post msg not just them though they have more impact but never know u or me can also make impact on being safe Just recovered even mild covid is putting me off from normal health for 1 2 months so pls take care and stay safe,Positive
1384839575001051138,,,2021-04-21 17:30:58 +0530,Pre pandemic 35 of business travelers raised concerns about the impact of it on their mental health Post Covid 73 said they ll be prioritizing their mental Wellbeing when travelling in future Travel BusinesTravel communications,Negative
1384673384290783234,,,2021-04-21 06:30:35 +0530,Revisiting the Mental Health Impact of COVID 19 and A Way Forward in the Post Pandemic Era Read on,Negative
1384446180596256771,,,2021-04-20 15:27:45 +0530,How can global pharma reinforce their purpose post COVID and remind everyone their goals extend far beyond just selling drugs and generating profits De link focus on sales and build a new regulatory system that promotes their impact on global health,Positive
1384439515356479491,,,2021-04-20 15:01:16 +0530,Sobering stuff Post Covid impact on health system demand on top lenthy waiting lists mentalhealth Neurology 6 month neurological and psychiatric outcomes in 236 u2009379 survivors of COVID 19 a retrospective cohort study using electronic health records,Positive
1384342864646320128,,,2021-04-20 08:37:13 +0530,What is the impact of COVID 19 pandemic on mental health around the world To build back better post pandemic common practice of relegating mental health to the margins of the health and development agendas has to end How u2066 u2066 u2069,Positive
1384299650841120768,,,2021-04-20 05:45:30 +0530,How to be a transformational supportive leader during COVID 19 The post Mental Health Impact of COVID 19 Affects Leadership in the Workplace appeared first on The Good Men Project Menta via leadership TuesdayTravel,Positive
1384221579589021702,,,2021-04-20 00:35:16 +0530,Join us for our next Insights Transforming Post COVID Health Care Session 5 Digital Health Impact on Health Care Inequities Register here,Neutral
1384200009323745281,,,2021-04-19 23:09:34 +0530,Managing Post COVID Syndrome Long COVID What are the health and employment impacts on small business owners FSB Care and FSB Employment Protection answer your most frequently asked questions about long COVID and its impact on health and employment,Positive
1384100446285963269,,,2021-04-19 16:33:56 +0530,What are the practical implications of long term homeworking post COVID for employers Gillian Moore Associate in our employment team outlines the impact on handling flexibleworking requests health and safety and employee relations,Negative
1383887899070918661,,,2021-04-19 02:29:21 +0530,Post Edited KHN s What the Health Pause and Impact on Covid Vaccines,Neutral
1383797788907954184,,,2021-04-18 20:31:17 +0530,Insights Live presents Digitally Transforming Post COVID Health Care Digital Health Impact on Health Care Inequities is on 4 21 at 4PM Don t miss SESSION FIVE with speakers Anand K Devaiah MD FACS and Rebecca Grochow Mishuris MD MS MPH,Positive
1383652886962348032,,,2021-04-18 10:55:29 +0530,Hear Drs Drumm McNaughton and Tom Marrs discuss how the real impact on people s mental and psychological health and mental well being post COVID is yet to be seen Changing Higher Ed podcast changinghighered thechangeleader thechangeldr,Positive
1382706934290247680,,,2021-04-15 20:16:37 +0530,Take action Learn more about the impact of COVID 19 on Black maternal health specifically in Brazil RT this post nd use the hashtags bmhw21 and BlackMaternalHealthWeek Donate to support repro health and rights especially for Black women,Positive
1382619706062823429,,,2021-04-15 14:30:00 +0530,Join TODAY at 12pm UK time for the upcoming webinar COVID 19 The Pandemic s Impact on Health in the Commonwealth Discussing how we can create better prepared more resilient health programming post COVID19 Register here,Positive
1382347882775379975,,,2021-04-14 20:29:52 +0530,s provided the background paper Older Persons and the Post Covid 19 Agenda He reflected on the disproportionate impact on the health lives rights and welfare of older people during Covid longevity ageing,Positive
1382257326208471040,,,2021-04-14 14:30:02 +0530,Join TOMORROW at 12pm UK time for the upcoming webinar COVID 19 The Pandemic s Impact on Health in the Commonwealth Discussing how we can create better prepared more resilient health programming post COVID19 Register here,Positive
1381987566359044103,,,2021-04-13 20:38:06 +0530,How will the modernization of health and pharma analytics impact a post Covid world shares his five predictions with Spoiler decentralizedtrials were high on the list,Positive
1381836396244000769,,,2021-04-13 10:37:24 +0530,Religion has deep impact on mental health and affects the brain area related to logic and common sense Similar to post Covid actually,Negative
1381634824172109828,,,2021-04-12 21:16:26 +0530,Just 3 days to go until our webinar on the impact of COVID19 on long term respiratory health We will examine models of care for post COVID patient assessment and recovery with Prof Gisli Jenkins amp Dr hurley CF IPF ILD,Negative
1381608044174307332,,,2021-04-12 19:30:01 +0530,Join for the upcoming webinar COVID 19 The Pandemic s Impact on Health in the Commonwealth Discussing how we can create better prepared more resilient health programming post COVID19 Thu 15th April 12 00pm UK Register here,Positive
1381562006579392512,,,2021-04-12 16:27:05 +0530,Impact of active commuting and green space on health and wellbeing in a post covid society Dr Lindsay Bottoms l bottoms ac uk,Negative
1381427871567208450,,,2021-04-12 07:34:04 +0530,This will be the next impact of the crisis post COVID 19 The impact on these young children s lives will be the true public health disaster,Positive
1381351414321012737,,,2021-04-12 02:30:16 +0530,One key focus of public health is occupational health and safety Our final NPHW blog post focuses on the impact of COVID 19 on essential workers in Massachusetts PublicHealthWeek,Neutral
1380824778207019010,,,2021-04-10 15:37:36 +0530,Exciting funded PhD to study the Impact of active commuting and green space on health and wellbeing in a post covid society with Check it out in the link Please RT and circulate,Negative
1380563421247238146,,,2021-04-09 22:19:03 +0530,New Study of Post COVID Brain Issues Could Have Huge Impact on WC More than one third of patients develop a mental health and or neurological condition six months after they ve had COVID 19 according to a new study Read More protectinginjuredworkers,Positive
1380558762457538564,,,2021-04-09 22:00:33 +0530,Yes however that basic mortality statistic doesn t seem to cover all the long term post COVID 19 complications and effects not to mention mental health issues as well Flu on its own doesn t appear to have quite the same impact as COVID 19 on that front,Positive
1380492200618962946,,,2021-04-09 17:36:03 +0530,Blog Post As tragic and devastating as COVID 19 has been and will continue to be as the impact on mental health and long term learning becomes apparent it has given some great insights into what education should consider in the future COVID19 FlexibleLearnin,Negative
1380370935274954753,,,2021-04-09 09:34:11 +0530,truther Some lady liked this post If you re into public health truthing it s dangerous misinformation not to express how large an impact obesity has on Covid Same with vitamin D levels and age,Positive
1379820023087312899,,,2021-04-07 21:05:03 +0530,Have you read our second blog post yet While our teens have largely been spared from the physical health consequences of COVID 19 recent data reveals the psychological impact that the pandemic has had on young people in our community is significant,Positive
1379784408270528513,,,2021-04-07 18:43:32 +0530,Post KFF poll 62 of health care workers say covid 19 stress had negative impact on their mental health The Washington Post gt Yeah Try living black in America then let s talk about stress,Negative
1379735791832817665,,,2021-04-07 15:30:21 +0530,On WorldHealthDay we re focusing on the impact of COVID 19 on mental health with clinical psychologist Discover the communities at risk and steps we can take to rebuild relationships as we move into this near post pandemic phase,Neutral
1379594927466766344,,,2021-04-07 06:10:36 +0530,Post KFF poll 62 of health care workers say covid 19 stress had negative impact on their mental health The Washington Post,Negative
1379523937328041984,,,2021-04-07 01:28:31 +0530,Long covid is a form of post viral syndrome that is affecting 1 in 10 people infected even if v mild covid This includes kids The number of chronically ill adults and kids is going to have economic impact and another strain on health service,Negative
1379501857916211201,,,2021-04-07 00:00:47 +0530,If we want to recover and rebuild Wisconsin needs to address COVID s impact on workers and businesses but also to invest long term to build up our post pandemic economy and address critical worker shortages in careers like health services education amp construction,Negative
1379495229431050240,,,2021-04-06 23:34:27 +0530,Post KFF poll 62 of health care workers say covid 19 stress had negative impact on their mental health The Washington Post,Negative
1379481961534644227,,,2021-04-06 22:41:43 +0530,Post KFF poll 62 of health care workers say covid 19 stress had negative impact on their mental health The Washington Post,Negative
1379444918305882112,,,2021-04-06 20:14:32 +0530,Post KFF poll 62 of health care workers say covid 19 stress had negative impact on their mental health The Washington Post,Negative
1379433233364832265,,,2021-04-06 19:28:06 +0530,Post KFF poll 62 of health care workers say covid 19 stress had negative impact on their mental health The Washington Post,Negative
1379426099747291138,,,2021-04-06 18:59:45 +0530,Post KFF poll 62 of health care workers say covid 19 stress had negative impact on their mental health The Washington Post It ll only take five minutes of your day give it a read,Negative
1379425071354249216,,,2021-04-06 18:55:40 +0530,Post KFF poll 62 of health care workers say covid 19 stress had negative impact on their mental health The Washington Post,Negative
1379425013749669889,,,2021-04-06 18:55:26 +0530,I can imagine it s higher than this percentage amp still they have to put up w foolish disbelievers adding fuel to the fire Post KFF poll 62 of health care workers say covid 19 stress had negative impact on their mental health The Washington Post,Negative
1379422669091840001,,,2021-04-06 18:46:07 +0530,Post KFF poll 62 of health care workers say covid 19 stress had negative impact on their mental health The Washington Post u2066 u2069 u2066 u2069,Negative
1379422668185866241,,,2021-04-06 18:46:07 +0530,Post KFF poll 62 of health care workers say covid 19 stress had negative impact on their mental health The Washington Post,Negative
1379422613341081600,,,2021-04-06 18:45:54 +0530,Post KFF poll 62 of health care workers say covid 19 stress had negative impact on their mental health The Washington Post,Negative
1379422566352363521,,,2021-04-06 18:45:42 +0530,Post KFF poll 62 of health care workers say covid 19 stress had negative impact on their mental health The Washington Post,Negative
1379422395690323969,,,2021-04-06 18:45:02 +0530,Post KFF poll 62 of health care workers say covid 19 stress had negative impact on their mental health The Washington Post,Negative
1379410623042293760,,,2021-04-06 17:58:15 +0530,Wash Post KFF poll 61 of health care workers say covid 19 stress had negative impact on their mental health,Negative
1379408873698770949,,,2021-04-06 17:51:18 +0530,Post KFF poll 61 of health care workers say covid 19 stress had negative impact on their mental health The Washington Post,Negative
1379404394433761280,,,2021-04-06 17:33:30 +0530,MorningJoe Post KFF poll 61 of health care workers say covid 19 stress had negative impact on their mental health The Washington Post,Negative
1379402038275084290,,,2021-04-06 17:24:08 +0530,Guaranteed this number is actually lowballed Post KFF poll 61 of health care workers say covid 19 stress had negative impact on their mental health The Washington Post,Negative
1379400401238261762,,,2021-04-06 17:17:38 +0530,Post KFF poll 61 of health care workers say covid 19 stress had negative impact on their mental health The Washington Post,Negative
1379400077974863873,,,2021-04-06 17:16:21 +0530,Many if not most of these adults are parents If the parent is suffering the child is too mentalhealtatters Post KFF poll 61 of health care workers say covid 19 stress had negative impact on their mental health The Washington Post,Negative
1379399411642593280,,,2021-04-06 17:13:42 +0530,Post KFF poll 61 of health care workers say covid 19 stress had negative impact on their mental health The Washington Post,Negative
1379399357766774784,,,2021-04-06 17:13:29 +0530,Post KFF poll 61 of health care workers say covid 19 stress had negative impact on their mental health The Washington Post,Negative
1379399307649032194,,,2021-04-06 17:13:17 +0530,Post KFF poll 61 of health care workers say covid 19 stress had negative impact on their mental health The Washington Post,Negative
1379350296216829955,,,2021-04-06 13:58:32 +0530,In the post COVID world an inactive lifestyle has had a negative impact on your health leading to weight gain Yoga is your only savior in such times Heal your soul amp deal with your body with Yoga We are your SwasthyaMantraStudio Register,Negative
1378784273805770759,,,2021-04-05 00:29:22 +0530,CDC 2 509 Deaths Following Experimental COVID 19 Vaccines Now Equal to Total Deaths Recorded After Vaccines for the Past Decade article on Health Impact News com unable to post,Negative
1377908667035475969,,,2021-04-02 14:30:01 +0530,Join for the upcoming webinar COVID 19 The Pandemic s Impact on Health in the Commonwealth Discussing how we can create better prepared more resilient health programming post COVID19 Thur 15th April 12 00pm UK Register here,Positive
